{
  "projection_name": "billing-mrr-projection",
  "cursor": {
    "last_event_id": "evt-sub-acme-01-0002",
    "last_event_at": "2026-03-01T00:05:00Z"
  },
  "freshness": {
    "as_of": "2026-03-01T00:06:00Z",
    "lag_seconds": 60,
    "stale": false
  },
  "rebuild": {
    "status": "not_rebuilding",
    "started_at": null,
    "completed_at": null
  },
  "reconciliation": {
    "last_reconciled_at": "2026-03-01T00:00:00Z",
    "discrepancies_found": 0
  }
}
